{
  "episode_id": "ep02",
  "slug": "ep02-concepts-speaking",
  "topic": "概念准备（下）谁在说话：读懂图需要的另外四块砖——划杠主体 $（语言的产品不是主人）、大他者 A（能指的宝库不是某个人）、自我 m vs 主体 $（画面用来盖缝）、需要/要求/欲望三角（欲望住在撕开的缝里）。",
  "cross_chapter_threads": [
    {
      "chapter_id": "ch02",
      "mechanism": "划杠主体 $——语言的产品，不是语言的主人。拉康拧转笛卡尔：「我在我不在之处思，故我在我不思之处在」（1957《无意识中字母的动因》结尾，英译本《Écrits》p.166）：思想发生的地方（能指链上）与「我存在」的地方不是同一个点，你只是思想经过的一站，主体从「它思」（ça pense）出发。英语 subject 兼「主体/臣服者」两义，拉康取后者——「你说话」的真相是「话说你」。图上位置：左上角 △ 是事后倒推的「神话」起点（沉默的主体，没人真在语言之前存在过），穿过能指的隘口（defiles of the signifier）后变成 $（划杠主体，sujet barré）；杠来自「表达出来的永远是语言说得出的那个版本」；示意图中 $ 被压在能指链 S→S′ 底下；$ 是结构位置，不是残缺的个人。例子：自我介绍、写简历、解释「我其实是个怎样的人」——每次开口都是给语言递照片。"
    },
    {
      "chapter_id": "ch02",
      "mechanism": "大他者 A——你在跟「语言本身的总仓库」说话。A（Autre）是能指的宝库（trésor du signifiant）：一种语言里全部能指的集合、整个象征秩序；褚孝泉译作「能指富藏的地方」。它不是爸妈、老板、社会排行榜——那些是具体的人或机构，A 是结构性位置。引文：「主体由代码构成——因此，连他自己发出的讯息，也是从大他者那里接收的」（1960 Royaumont 会议报告《论主体的倾覆和在弗洛伊德无意识中的欲望的辩证法》，1966 收入《Écrits》，法文版 pp.806-807）；「代码」先别跟大他者划等号，第七篇拆上层链时再拆。图上位置：A 守在链上头，讯息点 s(A) 在 A 处（句号由大他者打）；讯息意义由接收方回溯决定（呼应上篇「意义在哪停下」的问题），接收方的位置就是 A；马蹄形矢线是欲望的路线，第四篇细走。例子：朋友圈精心措辞——真正在听的是「语言本身的总仓库」；点名——老师喊名字你应「到」，这一声「到」是主体被语言登记的时刻（ep07 语音召唤回收）。"
    },
    {
      "chapter_id": "ch02",
      "mechanism": "自我 m vs 主体 $——画面用来盖缝。自我（moi/ego）来自镜像阶段（stade du miroir）：婴儿在镜子里认出「那个完整的身影是我」，但镜中的形象是借来的——是他者的形象（i(a)，image de l'autre：「像我的人」的形象，不是你本人）。自我 m 是建立在误认（méconnaissance，把不是自己的形象认成自己）之上的想象构成，功能只有一个：补偿——把一个其实分裂的东西（$）拼成连贯的自画像。图上位置：图右侧是镜像层，m 和 i(a) 面对面；m 是一张画面，$ 是一道缝——画面用来盖缝，而它盖不住；头顶压着 I(A)，第六篇讲镜像路时再拆。例子：照镜子、自拍修图——修的是 i(a) 不是 $；$ 没法修：它不美不丑，它只是缺。"
    },
    {
      "chapter_id": "ch02",
      "mechanism": "需要、要求、欲望三角——那道盖不住的缝。需要（besoin/need）是纯粹的生物性不足：有「不足」没有「意义」，是沉默的；一开口进入语言，对满足的需要就变成要求（demande/demand）——对爱的无条件要求，需要被「转译成爱的证明」（transmutes them into proofs of love，《Écrits》）。要求是无条件、绝对的：任何具体的东西（奶、玩具、抱抱）只够当一次爱的证明，而能指链永远指向下一环——「证明」永远不够。图上位置：竖列骨架 △（沉默的需要）→ 开口穿过语言 → $ → D（要求）；D 与 △ 之间那道永远合不上的缝就是欲望（désir/desire）。吴琼公式：欲望＝要求－需要（吴琼《雅克·拉康：阅读你的症状》，吴琼公式，非拉康原话）；拉康原句：「欲望在要求从需要撕裂开的边缘涌现」（Le désir s'ébauche dans la marge où la demande se déchire du besoin，《Écrits》法文版 p.814）——「撕开」：要求像一层布盖在需要上，盖不严，欲望住在缝里。译名陷阱：中文一个「需求」常把「需要」「要求」糊成一样，三角坍成两角；「欲望本身」要到俄狄浦斯之后才完整成形；要求的「永远不够」在图上是一个圈（s(A)→A→s(A)），第五篇专门走。例子：奶瓶塞过去孩子还闹——他要的是「奶被笑着递过来」，不是奶。"
    },
    {
      "chapter_id": "ch02",
      "mechanism": "小结——两个人，一张画面，一道缝。四块砖收束：$ 是穿过语言的划杠主体（语言的产品不是主人）；A 是大他者（能指的宝库不是某个人）；m 是照镜子拼出来的自我（形象借来的 i(a)，画面用来盖缝）；需要、要求、欲望——沉默、开口、差一点，三角立在语言边上。链上两个「人」认全了：说话的 $ 和听话的 A；两条路认了个形状：能指链，和要求的圈。下一站走最底下的路：能指链本身，看意义到底怎么动、句号到底由谁打（ep03 缝合点回收）。"
    }
  ],
  "key_mechanisms": [
    "「它思」与划杠主体：拉康拧转笛卡尔——「我在我不在之处思，故我在我不思之处在」（1957《无意识中字母的动因》结尾，英译本《Écrits》p.166）；主体从 ça pense 出发，subject 取「臣服者」义（话说你）；△ 穿过能指的隘口（defiles of the signifier）变 $，$ 是结构位置不是残缺个人，说话者被压在链底下",
    "大他者 A 的结构性位置：能指的宝库（trésor du signifiant，褚译「能指富藏的地方」）不是爸妈/老板/排行榜；「主体由代码构成——因此，连他自己发出的讯息，也是从大他者那里接收的」（1960 Royaumont 报告，法文版《Écrits》pp.806-807）；A 守在链上头、讯息点 s(A) 句号由大他者打；「代码」与 A 的区分留待 ep07",
    "自我 m 是误认的想象构成：镜像阶段镜中形象是借来的 i(a)（image de l'autre）；méconnaissance 把不是自己的形象认成自己，功能只有补偿；镜像层 m 与 i(a) 面对面——m 是画面、$ 是缝，画面盖不住缝；头顶压着 I(A)，ep06 再拆",
    "需要→要求→欲望三角：需要是沉默的（有不足无意义）；开口变要求——「对爱的无条件要求」，需要被「转译成爱的证明」（transmutes them into proofs of love，《Écrits》）；D 与 △ 之间合不上的缝是欲望 d；拉康原句「欲望在要求从需要撕裂开的边缘涌现」（法文版《Écrits》p.814）；吴琼公式 欲望＝要求－需要（《雅克·拉康：阅读你的症状》，非拉康原话）",
    "译名陷阱与概念可区分性（arc 争议框架）：中文一个「需求」把需要/要求糊成两角、三角坍成两角——译名之争的本质是概念可区分性之争（马元龙四误译批判 vs 褚孝泉 nous/je 回应，voice-002/voice-003）",
    "图的定位语法（为后续铺路）：$ 在链底下、A 在链上头，链上两个「人」认全；讯息意义由接收方回溯决定（ep03 缝合点回收）；要求的「永远不够」是圈 s(A)→A→s(A)（ep05 回收）；点名「到」——主体被语言登记（ep07 语音召唤回收）"
  ],
  "voices_refs": [
    "voice-002",
    "voice-003",
    "voice-015"
  ],
  "narrative_anchors": [
    {
      "chapter_id": "ch02",
      "section": "划杠主体 $：语言的产品，不是语言的主人"
    },
    {
      "chapter_id": "ch02",
      "section": "大他者 A：你在跟「语言本身的总仓库」说话"
    },
    {
      "chapter_id": "ch02",
      "section": "自我 m vs 主体 $：画面用来盖缝"
    },
    {
      "chapter_id": "ch02",
      "section": "需要、要求、欲望三角：那道盖不住的缝"
    },
    {
      "chapter_id": "ch02",
      "section": "小结：两个人，一张画面，一道缝"
    }
  ]
}
