{
  "episode_id": "ep01",
  "slug": "ep01-three-stage-decoupling",
  "topic": "为什么一个请求要拆成三截、跑在两个进程里：三段式异步解耦",
  "cross_chapter_threads": [
    {
      "chapter_id": "ch04",
      "mechanism": "三段式异步解耦的完整蓝图：AsyncLLM 的 add_request 将一个请求同时扇出到三条异步路径——Stage1 InputProcessor 在本进程做 tokenize/校验/组装 EngineCoreRequest；Stage2 AsyncMPClient 经 ZMQ 投递到独立子进程的 EngineCoreProc（run_busy_loop 取请求→step→出输出）；Stage3 OutputProcessor 的后台 output_handler 将 EngineCoreOutputs 解多路复用、去 token 化、分回各请求的 RequestOutputCollector 信箱。generate() 是消费者，output_handler 是生产者，两者通过 per-request 信箱异步解耦。"
    },
    {
      "chapter_id": "ch02",
      "mechanism": "一条请求的两进程分叉模型：AsyncLLM.add_request 同时把请求分两路——本进程 OutputProcessor.add_request 建 RequestState + RequestOutputCollector 信箱（消费者侧），引擎进程 AsyncMPClient.add_request_async 经 ZMQ 投递 EngineCoreRequest（生产者侧）。同一个 request_id 挂在两个进程的不同数据结构上。generate() 通过信箱 get_nowait/get 消费结果，完全不接触引擎进程。"
    },
    {
      "chapter_id": "ch05",
      "mechanism": "Stage 1 输入预处理的 IPC 边界意识：InputProcessor.process_inputs() 在本进程完成三道校验关卡→归一化 tokenize→多模态 placeholder 展平排序→SamplingParams 克隆补全→组装 EngineCoreRequest。tokenization 在进入 IPC 边界前完成——CPU 密集的 tokenize 留在 API 进程，不让 GPU 在独立进程里等人。EngineCoreRequest 是 msgspec.Struct，为跨进程 IPC 优化（array_like/omit_defaults/gc=False），是进入引擎进程的标准化载荷。"
    },
    {
      "chapter_id": "ch07",
      "mechanism": "ZMQ IPC 跨进程通信实现：引擎进程侧 EngineCoreProc 起两个守护 IO 线程——process_input_sockets（DEALER 收 ZMQ 消息→msgpack 解码→投 internal input_queue）与 process_output_sockets（从 output_queue 取→msgpack 编码→PUSH 发 ZMQ）；主线程只跑 run_busy_loop 消费 input_queue、生产 output_queue。三个执行单元通过两个 queue.Queue 解耦，使 ZMQ 收发与 GPU 前向并行。msgpack 多帧零拷贝编码：小张量内联进主帧，大张量走 aux_buffers 零拷贝旁路，多模态张量经 torch_shm 共享内存带外通道。"
    },
    {
      "chapter_id": "ch08",
      "mechanism": "Stage 3 输出处理与 per-request 信箱解多路复用：OutputProcessor.process_outputs() 是唯一遍历整批 EngineCoreOutputs 的单循环——按 req_id 查 RequestState 表→增量去 token 化→停止串检测→make_request_output 生成 RequestOutput→通过 RequestOutputCollector.put 投递到对应请求的信箱。StreamInterval 节流 + DELTA 归并 + n>1 父聚合全在这个单循环里完成。一条函数管整批，一条队列喂一个流。"
    },
    {
      "chapter_id": "ch11",
      "mechanism": "EngineCoreProc 独立进程的忙循环：run_busy_loop 不断从 input_queue 取 (EngineCoreRequestType, payload)→调 EngineCore.step()（内部 schedule→execute_model→sample_tokens→update_from_output 四步一拍）→产出 EngineCoreOutputs 投 output_queue。step() 执行期间新到达的 ADD/ABORT 请求只在 input_queue 排队，不打断当前一拍。通过 EngineShutdownState（RUNNING/REQUESTED/SHUTTING_DOWN）和 PauseState 管理生命周期。这是三段式中段独立进程的心跳——为 ep02 展开四步循环埋下伏笔。"
    },
    {
      "chapter_id": "ch01",
      "mechanism": "v0 到 v1 架构跃迁的动机：v0 是单进程同步路径（LLMEngine 直接驱动 EngineCore step），v1 引入独立 EngineCore 子进程 + 异步解耦。核心动机：服务场景下 tokenization/去 token 化是 CPU 密集型操作，若与 GPU 前向在同进程同步执行，GPU 会在 tokenization 期间空转。三段式将 CPU 活（Stage1/Stage3）留在 API 进程，GPU 活（Stage2 EngineCore）锁在独立进程——让 GPU 不等 CPU。LLM（离线同步）与 AsyncLLM（服务异步）共用同一套 EngineCore 内核，仅驱动方式不同（InprocClient 直接调 step_fn vs AsyncMPClient 经 ZMQ 异步驱动）。"
    }
  ],
  "key_mechanisms": [
    "三段式异步扇出（add_request 三路分叉：InputProcessor / EngineCore / output_handler）",
    "两进程分叉与 RequestOutputCollector 信箱生产-消费异步解耦",
    "Stage 1 预处理 IPC 边界意识（tokenize 不进引擎，GPU 不等 CPU）",
    "ZMQ IPC + msgpack 多帧零拷贝序列化 + 两 IO 线程解耦",
    "Stage 3 单循环解多路复用（一条函数管整批，一条队列喂一个流）",
    "EngineCoreProc 独立进程忙循环（run_busy_loop，四步一拍的心跳）",
    "v0→v1 架构跃迁：一套内核，两种驱动（同步 InprocClient / 异步 AsyncMPClient）"
  ],
  "voices_refs": [
    "voice-001",
    "voice-002",
    "voice-036"
  ],
  "narrative_anchors": [
    {
      "chapter_id": "ch04",
      "section": "4.1 一句话钩子：为什么要拆成三段"
    },
    {
      "chapter_id": "ch04",
      "section": "4.2 三段在哪里诞生：`__init__` 的构造与背景任务"
    },
    {
      "chapter_id": "ch04",
      "section": "4.4 三段解耦的扇出点：`add_request` 与 `_add_request`"
    },
    {
      "chapter_id": "ch04",
      "section": "4.5 结果怎么回来：`output_handler` 背景任务（生产者）"
    },
    {
      "chapter_id": "ch04",
      "section": "4.8 IPC 上流动的是什么：两种跨进程消息"
    },
    {
      "chapter_id": "ch04",
      "section": "4.9 把三段串起来：完整时序"
    },
    {
      "chapter_id": "ch02",
      "section": "2.1 一张总图：三段式异步把整条链串起来"
    },
    {
      "chapter_id": "ch02",
      "section": "2.5 分叉点：同一个请求，同时挂到本进程和引擎进程"
    },
    {
      "chapter_id": "ch02",
      "section": "2.6 引擎段：一个独立进程，不停地算「一拍」"
    },
    {
      "chapter_id": "ch02",
      "section": "2.10 对照：一套核心，两种驱动"
    },
    {
      "chapter_id": "ch05",
      "section": "5.1 一句话钩子：tokenize 已经不在这里了"
    },
    {
      "chapter_id": "ch05",
      "section": "5.8 组装成品：`EngineCoreRequest`"
    },
    {
      "chapter_id": "ch07",
      "section": "7.7 两个 IO 线程：把 ZMQ 和 GPU 解耦"
    },
    {
      "chapter_id": "ch07",
      "section": "7.11 msgpack 多帧零拷贝：小张量内联，大张量旁路"
    },
    {
      "chapter_id": "ch08",
      "section": "8.1 一句话钩子：一个函数管整批，一条队列喂一个流"
    },
    {
      "chapter_id": "ch08",
      "section": "8.5 三道闸门：`make_request_output` 与 DELTA 归并"
    },
    {
      "chapter_id": "ch01",
      "section": "1.2 v1 相比 v0 变了什么"
    },
    {
      "chapter_id": "ch01",
      "section": "1.3 两个使用面：同一个内核，两种驱动"
    },
    {
      "chapter_id": "ch11",
      "section": "11.4 run_busy_loop：引擎的心跳"
    }
  ]
}