{
  "episode_id": "ep09",
  "slug": "ep09-critique",
  "topic": "走出图看它怎么被争论：中文接受史（吴琼的讲解与褚译本之争）、图过时了吗（从图式阶段到博罗米结拓扑，换重心不是换地基）、德勒兹的进攻（欲望是生产不是匮乏）、Fink vs Žižek（同一张图，临床忠实 vs 意识形态挪用）——图是争论的起点，不是终点。",
  "cross_chapter_threads": [
    {
      "chapter_id": "ch09",
      "mechanism": "中文接受史：两座绕不开的楼（博客小节「中文接受史：两座绕不开的楼」）：第一座楼是吴琼《雅克·拉康：阅读你的症状》（2011 年人大版，2024 年修订）第十章第三节「欲望图」——中文世界最重要的讲解文本；他的形容很有名：1960 年那篇文本是《文集》中「最为艰涩难懂的一个文本」，理论构件按循环往返的拓扑逻辑叠进四个图形，形成「巴洛克式的七宝楼台」，一般研究者「采取回避（绕行）的方式」，吴琼自称「贸然想要去做一次攀爬」。第二座楼是褚孝泉译《拉康选集》（上海三联书店 2001）——收有《论主体的倾覆……》，中文读者读它基本都经由褚译本，但这也是最有争议的译本：2006 年马元龙在《翻译需要敬畏之心（下）》（《博览群书》2006 年第 12 期）称它是「一本非常令人失望的译著」，最著名的两条批评是 phallus 译作「男根」应为音译「菲勒斯」（「纯粹的能指，一个没有所指的能指」，与生物学的阴茎 penis 不可混）与第一人称 je 被误译成复数「我们」；褚孝泉在《关于〈拉康选集〉的翻译问题》中回应：「我们」之争里马元龙抄录的原文实为第一人称复数 nous（英译本用 I 误导了他），法文惯用 nous 自指，「男根」与「阴茎」的区分正是斟酌再三的结果——他批评马元龙凭英译本评判中译文，而不是以法语原文为依据；论争没有官方胜负，它塑造的是语境本身。关键机制：一个词译错，理解就整个换层——按「男根」读，读者会把图上那个缺位词当成生物学器官；按「菲勒斯」读，它才是拉康要的那个东西——一个不指任何东西、只标示「缺位」本身的能指（该缺位词在图上的位置即篇 7 的 S(Ⱥ)，图顶端）。译名也随之不统一：graphe du désir 有「欲望图」（吴琼及学界多数）、「欲望图式」（周文莲，《世界哲学》2019 年第 1 期）、「欲望图解」「欲望图示」「欲望图表」等写法，褚译本作「图式」——严格说，拉康的 schéma（如 L 图式）才对应「图式」，graphe 更近「图/图解」；本系列以「欲望图」为准，不是仲裁，是约定。出处：ch09 博客第一节（吴琼/马元龙/褚孝泉引文原文保留）。"
    },
    {
      "chapter_id": "ch09",
      "mechanism": "图过时了吗：从图式阶段到结拓扑（博客小节「图过时了吗：从图式阶段到结拓扑」）：晚期教学的三步转向——1972–73 年的研讨班 XX《Encore》起，享乐（jouissance）获得「非全」（pas-tout）逻辑：否定不再来自禁令，而来自集合自身的逻辑，否定长在集合自身里；1974–75 年的研讨班 XXII《RSI》起，实在界（le réel）经由博罗米结（nœud borroméen，三只相互独立又互锁的环，任何一个断了其他两个也散开）展开；1975–76 年的研讨班 XXIII《Le sinthome》再加第四环 sinthome（圣状/症状，把结维系住的那一环）。学术文献的表述：欲望图所属的「图式阶段」连同莫比乌斯带、环面，被后期教学逐步取代（superseded），最终达至博罗米结。但「取代为理论重心」不等于「宣布失效」——这是两句话；更准确的画面是换重心而不是换地基：图与结回答的是不同层次的问题——图回答意义与欲望如何在能指链上缝合、定位（落点：主体在话里的位置），结回答三界与享乐如何在实在中纽结、维系（落点：主体在结构中的存在方式）；否则 Žižek 一脉 1989 年不可能还站在它上面做意识形态批判。「过时了吗」的答法不是「是/否」，是「换了重心」：图没有作废，理论兴趣从「意义如何缝合」移向了「三界如何互扣」。出处：ch09 博客第二节（含欲望图 vs 博罗米结对仗表）。"
    },
    {
      "chapter_id": "ch09",
      "mechanism": "德勒兹的进攻：欲望是匮乏还是生产（博客小节「德勒兹的进攻：欲望是匮乏还是生产」）：德勒兹与瓜塔里 1972 年的《反俄狄浦斯》（L'Anti-Œdipe）先看清它打在哪个部位——拉康式欲望的底座是匮乏（manque / lack）：主体因语言被划杠（$，篇 2）、欲望因缺失而起（篇 4）、规则因禁令而立；D&G 拒绝这个底座：欲望不是匮乏，是生产——欲望是机器（machine désirante，一台接了另一台、不断组装新组合的机器），「欲望的秩序即生产的秩序」；瓜塔里称拉康的能指是「专制能指」（despotic signifier）。最有名的反转是对禁令的拆解：「律法说：你将不娶你母亲、不杀你父亲。我们这些顺从的主体心想：原来这就是我想要的！」——先有禁止，欲望才被生产出来，禁令不是欲望的狱卒，是欲望的助燃剂。有意思的是，这条逻辑《论主体的倾覆……》里也有（图顶端就是被禁的享乐）；德勒兹却把矛头反过来：你把欲望画成匮乏，等于把它钉死在律法的影子里——匮乏底座在图上有三个落点：$ 的划杠、d 的「差一点」、S(Ⱥ)（大他者缺一个词），德勒兹要拆的正是这套「缺」的语法。本系列的定性：德勒兹不是批这张图画得不对——《反俄狄浦斯》没有针对图形细节逐条开火——他批的是它把欲望画成了匮乏：攻击在概念层，图只是被殃及的装置。两人还留下一段互评（据贝克曼《吉尔·德勒兹》传记转述，属二手材料，置信度中等）：拉康曾赞德勒兹「我所需要的正是像你这样的人」，德勒兹与瓜塔里在访谈中回敬「我们正是以精神分裂的方式帮助他」。例子：家长宣布「这部动画绝对不许看」的那天，孩子第一次真正想追它。出处：ch09 博客第三节。"
    },
    {
      "chapter_id": "ch09",
      "mechanism": "Fink vs Žižek：同一张图，两种用法（博客小节「Fink vs Žižek：同一张图，两种用法」）：布鲁斯·芬克是拉康的主要英译者——读法译者式、临床、忠实文本，他甚至曾称《论主体的倾覆……》「不可读」（评述文献转引）；齐泽克（Slavoj Žižek）用黑格尔—马克思的框架把图扛去做文化批判。最著名的挪用是《意识形态的崇高客体》（The Sublime Object of Ideology，1989）：图上的缝合点（point de capiton，篇 3）被读成意识形态缝合——一个主人能指（signifiant maître，一串漂浮能指里那个特权词）回溯性地定住其他词的意义；例子：「共产主义」——自由、国家、正义、民主每个词单独出现都是漂的，放进那句口号，四个词突然都有了确定的方向和次序，还让人以为「意义本就在那里」。注意钉子自己从不被追问——这正是篇 7 S(Ⱥ) 的逻辑：没有大他者的大他者，没有词能给最后的词定意义，系统靠一个「说不上来的词」维持；它抹去自己痕迹的那一下，也正是篇 4 幻象（$◇a）的拿手戏：遮住不一致，让剧本看起来像自然。同一张图，两种现场：芬克在分析室里用它读病人的话，齐泽克在讲座上用它读意识形态。四条路线之间四个可对照的落点（据 Sokolofsky 等人的批评整理）：女性享乐（Fink：虽涉「实在」仍可被照亮 vs Žižek：越出能指、近乎不可言说）；实在界的定义（「实在界……不存在」 vs 同时必然又不可能的实体）；主体的拓扑（莫比乌斯带——自我与无意识两面互扭 vs 被现实/幻象掩蔽的「被排除的内核」）；$◇D 与 sinthome（Fink：象征与实在交叉处的菲勒斯享乐 vs Žižek：把 $◇D 与后期 sinthome 直接等同——被 Jake Sokolofsky 在《(Un)quilting the Quilting Point》里逐点批评）。这里不必选边——同一张图能被两种用法同时「用坏」与「用活」，说明它承载的不是答案，而是一套传动。出处：ch09 博客第四节（含漂浮能指 vs 缝合点示意）。"
    },
    {
      "chapter_id": "ch09",
      "mechanism": "收尾：图不再绕行（博客小节「收尾：图不再绕行」）：三场争论走完，本系列收官；把整季叠回一句话：这张图不回答「你想要什么」，它回答「你为什么会要」——欲望不被回答，只被定位：在能指链上被构成、被缝合、被堵死、被遮住。三件工具可以带走了：读任何意义系统（一段话、一部剧、一个热搜），问三件事——它的缝合点在哪？（什么词或时刻让意义突然落定）它缺哪个词？（说不出、绕开的缺位——S(Ⱥ) 的位置）它遮住了什么？（什么幻象在盖住不一致）。这三问就是「穿越幻象」（traversée du fantasme，把剧本看清、然后放下的分析终点）的第一步——不是实现欲望，而是看清剧本；想继续走，还有三条路：穿越幻象、意识形态批判、博罗米结。收尾：带上全部零件重读开篇（01 无意识像语言），你会看见一座不再绕行的楼。出处：ch09 博客第五节。"
    }
  ],
  "key_mechanisms": [
    "中文接受史两座楼：吴琼「最为艰涩难懂/巴洛克式的七宝楼台/绕行/贸然攀爬」的讲解文本 vs 褚译《拉康选集》之争（马元龙《博览群书》2006 年第 12 期批评 vs 褚孝泉 nous/男根回应）——论争没有官方胜负，塑造的是语境本身",
    "一词换层：「男根」vs「菲勒斯」——按前者读图顶缺位词成了生物学器官，按后者读才是不指任何东西、只标示「缺位」本身的能指（= S(Ⱥ) 的位置）；graphe 译名约定：「欲望图」为准，不是仲裁是约定（schéma 才对应「图式」）",
    "过时论：晚期三步转向（XX《Encore》享乐「非全」逻辑 → XXII《RSI》博罗米结三环 → XXIII《Le sinthome》第四环）——学术文献「superseded」表述 vs 「取代为理论重心」≠「宣布失效」：换重心不是换地基，图答意义如何缝合、结答三界如何纽结，Žižek 一脉 1989 年站在图上做意识形态批判为证",
    "德勒兹的进攻：欲望是生产不是匮乏（machine désirante、「欲望的秩序即生产的秩序」、专制能指）——禁令是欲望的助燃剂（「律法说：你将不娶你母亲……」）；攻击在概念层，匮乏底座在图上的三个落点：$ 的划杠、d 的「差一点」、S(Ⱥ)；图顶端被禁的享乐本来就在《论主体的倾覆……》里",
    "Fink vs Žižek 同一张图两种用法：缝合点被挪用成意识形态缝合（「共产主义」回溯性钉住自由/国家/正义/民主四个漂浮能指）——钉子自己从不被追问 = 篇 7 S(Ⱥ) 逻辑，抹去痕迹 = 篇 4 幻象（$◇a）的拿手戏；四落点对照（女性享乐/实在界定义/主体拓扑/$◇D vs sinthome）",
    "Sokolofsky 的批评与收官：$◇D 是象征与实在交叉处的菲勒斯享乐，不是 sinthome——不必选边，同一张图能被两种用法同时「用坏」与「用活」，承载的是一套传动不是答案；三问工具（缝合点在哪/缺哪个词/遮住了什么）是穿越幻象的第一步；欲望不被回答，只被定位；系列闭环（重读开篇 01）"
  ],
  "voices_refs": [
    "voice-007",
    "voice-009",
    "voice-008"
  ],
  "narrative_anchors": [
    {
      "chapter_id": "ch09",
      "section": "中文接受史：两座绕不开的楼"
    },
    {
      "chapter_id": "ch09",
      "section": "图过时了吗：从图式阶段到结拓扑"
    },
    {
      "chapter_id": "ch09",
      "section": "德勒兹的进攻：欲望是匮乏还是生产"
    },
    {
      "chapter_id": "ch09",
      "section": "Fink vs Žižek：同一张图，两种用法"
    },
    {
      "chapter_id": "ch09",
      "section": "收尾：图不再绕行"
    }
  ]
}
