{
  "episode_id": "ep07",
  "slug": "ep07-path-upper-chain",
  "topic": "路径五上层链（享乐→阉割）：图最顶上那条路——双重复制让同一句话两层同时运转（陈述层 vs 陈述活动层），享乐是「再多一点，哪怕过头」、被禁令钉死，S(Ⱥ) 是大他者缺掉的那个词（没有大他者的大他者），驱力 $◇D 写在代码的位置只绕圈不追目标，它绕的那个圈对着语音召唤——你是先被喊的，然后才学会喊人；顶层是缺与禁，没有奖杯。",
  "cross_chapter_threads": [
    {
      "chapter_id": "ch07",
      "mechanism": "上层链与双重复制（博客小节「上层链与双重复制：两条一模一样的链」）：完整图（Graphe complet，法文版《Écrits》pp.816-820）里有两条横链——底部「能指 S→语音」是你说出口的话，陈述层（énoncé，法语「所述内容」）；顶部「享乐→阉割」是话里没说的那一半，陈述活动层（énonciation，言说这个动作本身），整张图的无意识层。关键在结构：拉康把两条链画得完全相同——双重复制（duplication），节点、方向一一对应；这是篇 1（ep01）「无意识像语言」的几何化：同一句话同时载着两层意义。Seminar VI 次讲（1958-11-19）特意强调：这两层绝不对应于通常的上下功能建筑——在最小的言语行为里，两层同时运作。图上位置：上层链在第三张图（Graphe 3，法文版 p.815）就以「被叠加的那一层」的形式出现，完整图里收齐；完整走法：享乐的位置 → S(Ⱥ) → $◇D → 阉割（法文版 pp.816-817）。先认链的终点：阉割（castration，去势）不是一场惩罚、没有刽子手——它是给「离开圆满」起的名字：婴儿曾经和母亲的身体贴在一起，那个状态是「全要」的；进入语言等于离开这个圆满，代价是永远差一块。承重例子：嘴上说「够了」，手指还在刷——「够了」是陈述层的内容，手指不停是陈述活动层在绕圈，一句话两层意思同时运转；删掉例子逻辑照旧：任何说出口的话都同时挂在两条结构相同的链上，一条管「说了什么」，一条管「说本身在干什么」。"
    },
    {
      "chapter_id": "ch07",
      "mechanism": "享乐与快乐（博客小节「享乐与快乐：刚刚好，再多一点」）：先纠正翻译事故——享乐（jouissance，法语日常词「享受、快感」，早年被译成「快感」）说的根本不是快乐；弗洛伊德的快感原则（pleasure principle）是趋乐避苦、把张力压到最低——快乐是「刚刚好」；享乐恰恰相反：再多一点，哪怕过头。它不保存你，它消耗你，所以常常和痛苦搅在一起。吴琼特意译「原乐」：对快感原则的超越、对法的僭越。图上位置：图的顶端一行、上层链的起点——拉康给顶端留了句标注（法文版《Écrits》pp.819-820，Fink 英译本页边标注法文页码）：「这地方，叫做享乐」（This place is called jouissance）；紧接着（p.821）补了一句更硬的：对说话者而言，享乐是被禁止的（la jouissance est interdite à qui parle comme tel）——为什么被禁、禁令是谁下的，下一小节揭晓。承重例子：蛋糕第一口是快乐（甜、满足、刚刚好），第三口、第四口舌头说够了手还想再切——那股「够了还来」的劲儿就是享乐；复吸的那一口、凌晨两点「再刷五分钟就睡」的五分钟，都是同一个结构：不是追求最大快乐，是要多一点、再多一点，哪怕伤到自己——人不是被快乐驱动的，那根不许顶破的管子顶破时喷出来的，才是享乐。"
    },
    {
      "chapter_id": "ch07",
      "mechanism": "S(Ⱥ)：大他者缺一个词（博客小节「S(Ⱥ)：大他者缺一个词」）：下禁令的位置叫父之名（Nom-du-Père）——给规则盖章的那个空位，一句人话：「不能全要」。先纠误会：父之名不是某个具体的爸爸，也不是「父权」——它是象征功能，语言里那个「说不出口但人人都默认」的禁令位置；想象里的父亲（爸爸这个人）只是这个空位的化身，爸爸可以软弱、缺席、破产，规则照样生效。拉康再推一步：规则的颁布者之上，还有颁布者吗？1960《论主体的倾覆和在弗洛伊德无意识中的欲望的辩证法》里那句著名断语（法文版 pp.818-819 交界，逐字）：没有大他者的大他者（qu'il n'y ait pas d'Autre de l'Autre）——大他者（A，能指的宝库）自己缺一个词，记作 S(Ⱥ)（signifiant du manque dans l'Autre，大他者的能指匮乏——大他者中缺掉的那个能指）。这里安置的不是活着的父亲，而是弗洛伊德神话里的亡父——《图腾与禁忌》里被儿子们联合杀死的原始部落之父：死人是最可靠的立法者——不会改口、不会收回成命、不会被推翻；活着的父亲可以被挑战，一个死去的名字不行，规矩从这个空位里说话。S(Ⱥ) 不是「大他者藏起来的答案」——是结构性的缺失；评注者 Soler 给它集合论的出身：一个集合不能既一致又完备，「所有能指的集合」要自证完整，必须有一个在集合之外的元素来点数——数完十个发现「少了一根」：能数的那根手指，不在被数的指头里。同住顶层享乐区的还有大他者的享乐 J(A)——它不是「大他者拥有的某种爽」，而是「爽」这个字在象征秩序里的缺席本身。承重例子：翻开任何一份规章制度，最后一行通常是「本规定的最终解释权归某某」——可那个「某某」的解释权又由谁来解释？一路问上去，最终落在一个说不上来的词上：那个词自己不解释自己，也没有别的东西替它解释；删掉例子逻辑照旧：象征秩序没有终极担保人，能指系统本身不完整，没有元语言。"
    },
    {
      "chapter_id": "ch07",
      "mechanism": "驱力 $◇D：写在代码位置的绕圈（博客小节「驱力 $◇D：写在代码位置的绕圈」）：享乐被禁了，人绕开走就是了——可你绕的恰恰是它；因为绕圈的不是欲望，是驱力（pulsion / drive，弗洛伊德的老词 Trieb，中文旧译「冲动」）。驱力与欲望差在哪：欲望（désir）有方向，指着永远差一点的目标（篇 4 / ep04：欲望是换喻）；驱力不问「想要什么」，它没有目标点，只有回路。图上的写法是 $◇D：划杠主体 $ 与要求 D 用那个「包含与不可能」的符号（◇）扣在一起——和幻象公式 $◇a 同一个 ◇。定义一句话说死（《论主体的倾覆…》法文版 p.817，逐字）：驱力是「要求中主体消隐后剩下的东西」（ce qui advient de la demande quand le sujet s'y évanouit）——注意措辞：不是「需要变成驱力」，是主体在要求上走到消隐，剩下的那个绕圈的东西。图上位置：$◇D 写在代码的位置；代码（code）不是密码本——它是词库＋规则，约等于语言本身（你开口用的全部能指）；为什么驱力贴在这里：因为主体正是在代码处被构成的——拉康原话（出自《Écrits》Graphe 1 的评注段，法文版 pp.806-807，注意出处是《Écrits》不是研讨班讲稿）：「主体由代码构成，这意味着，连他自己发出的讯息，也是从大他者那里接收的。」同段还说明：大他者 A 是能指宝库的位置，「并不是说就是代码」——宝库是地点，代码是构成层。Seminar VI 首讲（1958-11-12）把代码处形容为「能指的电池」：「四个的电池」（une batterie de 4），并非不可设想；虚线与能指链相交的两点里，第一处就是代码点（① code），第二处才是讯息点（② message）。查证结论要钉牢：$◇D 属于最上层（阶段 4，与享乐、阉割同层），不在第二层——No Subject、Wikipedia、Soler、Eidelsztein 的讲法一致；绕圈这件事不在图的基层，而在离享乐最近的地方：满足的终点被禁掉了，剩下的就是一个没有终点的回路。承重例子：深夜刷手机——你已经「不想看了」，手指还在上滑；嘴上说「够了」，手不听，因为有个声音在喊「还不够」（篇 5 / ep05 的超我）：那个声音没有面孔，就在你耳朵里。"
    },
    {
      "chapter_id": "ch07",
      "mechanism": "语音召唤（博客小节「语音召唤：被喊到名字之前」）：驱力绕的那个圈，绕的对象是语音；语音召唤（pulsion invocante / invocatory drive，以语音为对象的驱力）是拉康在 1964 年 3 月的 Seminar XI《精神分析的四个基本概念》驱力诸讲里正式命名的。原句（法文版《四概念》p.96，回应萨福安提问时说的，逐字）：在观看层面，我们已经不在要求的层面，而在欲望、在大他者的欲望的层面；召唤性驱力亦然，它最接近无意识的经验。前史三个画面：① fort-da——弗洛伊德的孙子把线轴抛出去又拉回来（「fort！没了」「da！回来了」），拉康注意到这游戏的咒歌式特征：孩子口中那些「会唱歌的音素词」先于任何意义，已经是一个绕声音的回路；② shofar（公羊角号）——Seminar X《L'Angoisse》1963 年 5 月 22 日那一讲，拉康引雷克（Theodor Reik）的话：shofar 说到底不是别的，是上帝的声音、雅赫维的声音；又点破它的位置：弑父及它所统摄的一切，在号声里回响（STA-F 讲稿逐字）——一个字都没有，但整个共同体站住了，语音召唤不必是言语；③ 蒙克《呐喊》——画中人捂着耳朵、张着嘴，被声音淹没却喊不出声：被召唤、却还不会召唤的姿势。诚实交代：「象征界的来临」是评述者的转述，不是拉康原话，这里不引。图上位置：下层链的终点不是「意思」，是语音；上层链的终点是阉割——拉康把语音与阉割放在图的同一侧（法文版《Écrits》pp.816-818）；绕圈绕到最后剩下的那个东西——声音——正守在享乐被禁的切口旁边。查证边界：「invocation」并没有作为独立节点被直接标注在图上——本系列按有据的链条写作：语音＝下层链终点＋召唤性驱力的对象＋与阉割同侧。承重例子：点名——老师喊「张三」，你应声：那个「是」不是你想好了才说的，在你来得及想「我是谁」之前，一个声音已经占住了一个位置；主体最先的形态不是说话者，是被召唤者；能喊别人名字（成为召唤者），是后来的事。声音先于意义，召唤先于说话。"
    },
    {
      "chapter_id": "ch07",
      "mechanism": "小结：顶层是缺与禁（博客小节「小结：顶层是缺与禁」）：顶层链三件事——一，上层链与下层链结构完全相同（双重复制）：一条管「说了什么」，一条管「说本身在干什么」，最小的一句话里两层同时运作；二，享乐是「再多一点，哪怕过头」，被父之名的禁令钉死；S(Ⱥ) 就是大他者缺掉的那个词——没有大他者的大他者，缺失的钉子，安置着亡父；三，$◇D（驱力）写在代码的位置——驱力是「要求中主体消隐后剩下的东西」，只绕圈，不追目标；它绕的那个圈对着语音召唤：你是先被喊的，然后才学会喊人。图上位置与结论：顶层没有奖杯——一个缺位的词，一道禁令，一个回路；图的顶端是结构性的失败：能指在享乐的位置缺席，享乐被禁。但五条路是同时运转的：能指链滑动、缝合点钉住、矢线追目标、圆圈转不停、镜像盖缝、驱力绕圈——没有先后，只有同时；这就是为什么嘴上说「够了」，手指还在刷：你整个人就是这张图。钩子：五条路都走完了，现在该把图完整摆上桌，看这些零件怎么同时传动（→ 下一篇 08-full-graph）。"
    }
  ],
  "key_mechanisms": [
    "双重复制（duplication）：上层链（陈述活动层 énonciation，享乐→阉割）与下层链（陈述层 énoncé，能指 S→语音）结构完全相同、节点方向一一对应——「无意识像语言」的几何化；最小的言语行为里两层同时运作（Seminar VI 次讲 1958-11-19；完整图法文版《Écrits》pp.816-820；Graphe 3 p.815；完整走法 pp.816-817）；阉割不是惩罚而是「离开圆满」的代价",
    "享乐 vs 快乐：快感原则是「刚刚好」、趋乐避苦、把张力压到最低；享乐是「再多一点，哪怕过头」，不保存你、消耗你、与痛苦相搅；吴琼译「原乐」=对快感原则的超越、对法的僭越；图上标注逐字：顶端「这地方，叫做享乐」（pp.819-820）+「对说话者而言，享乐是被禁止的」（p.821）",
    "S(Ⱥ) 大他者的能指匮乏：父之名（Nom-du-Père）是象征禁令空位（「不能全要」），不是爸爸这个人也不是父权；「没有大他者的大他者」（qu'il n'y ait pas d'Autre de l'Autre，pp.818-819 交界逐字）；结构性缺失而非藏起来的答案——Soler 集合论出身（集合不能既一致又完备，数完十个发现少了一根）+ 安置亡父（《图腾与禁忌》：死人是最可靠的立法者）；同住顶层的 J(A) 大他者的享乐是「爽」在象征秩序里的缺席本身",
    "驱力 $◇D：写在代码（code=词库＋规则≈语言本身）的位置——因为主体由代码构成（《Écrits》Graphe 1 评注段 pp.806-807 逐字「主体由代码构成，这意味着，连他自己发出的讯息，也是从大他者那里接收的」；A 是宝库地点「并不是说就是代码」；Seminar VI 首讲 1958-11-12「能指的电池」「四个的电池」；虚线交点 ① code ② message）；定义逐字（《论主体的倾覆…》p.817）：「要求中主体消隐后剩下的东西」（ce qui advient de la demande quand le sujet s'y évanouit）——不是「需要变成驱力」；只绕圈不追目标（vs 欲望换喻）；$◇D 属最上层阶段 4（No Subject/Wikipedia/Soler/Eidelsztein 一致）",
    "语音召唤（pulsion invocante）：以语音为对象的驱力，Seminar XI 驱力诸讲（1964 年 3 月）正式命名（法文版《四概念》p.96 回应萨福安，逐字）；三前史——fort-da 咒歌式音素词回路 / shofar 上帝的声音（Seminar X 1963-05-22，STA-F 逐字，「弑父及它所统摄的一切，在号声里回响」）/ 蒙克《呐喊》被召唤却还不会召唤；语音与阉割同侧（法文版《Écrits》pp.816-818）；「象征界的来临」是评述者转述不引、「invocation」非图上独立节点",
    "顶层是缺与禁：一个缺位的词、一道禁令、一个回路——图的顶端是结构性的失败（能指在享乐的位置缺席，享乐被禁）；五条路同时运转没有先后；「嘴上说够了，手指还在刷：你整个人就是这张图」"
  ],
  "voices_refs": [
    "voice-002",
    "voice-012",
    "voice-017"
  ],
  "narrative_anchors": [
    {
      "chapter_id": "ch07",
      "section": "上层链与双重复制：两条一模一样的链"
    },
    {
      "chapter_id": "ch07",
      "section": "享乐与快乐：刚刚好，再多一点"
    },
    {
      "chapter_id": "ch07",
      "section": "S(Ⱥ)：大他者缺一个词"
    },
    {
      "chapter_id": "ch07",
      "section": "驱力 $◇D：写在代码位置的绕圈"
    },
    {
      "chapter_id": "ch07",
      "section": "语音召唤：被喊到名字之前"
    },
    {
      "chapter_id": "ch07",
      "section": "小结：顶层是缺与禁"
    }
  ]
}
