{
  "episode_id": "ep05",
  "slug": "ep05-path-circle",
  "topic": "路径三屈从圆圈 s(A)→A→s(A)：把主体圈起来的回路——屈从是一个圆圈（Graphe 1 的细胞单元）、需求的环形地狱（每圈都差一点）、Che vuoi?（大他者不回答，反抛问题）、「人的欲望是他者的欲望」（de 的主/宾格双关，不是模仿，是结构）",
  "cross_chapter_threads": [
    {
      "chapter_id": "ch05",
      "mechanism": "屈从是一个圆圈：路二的后半截单独成环——马蹄形矢线折上大他者 A 后没有停下，它折回来，落回能指链尾端的缝合点 s(A)（篇 3 那个「意义事后才落定」的句号位）。褚孝泉译《拉康选集》原文：「主体对能指的屈从产生在从 s(A) 到 A 随后又从 A 回到 s(A) 的路程中的。这个屈从是一个圆圈。」「屈从」就是被语言压着走、意义不由自己定音——不是一次性臣服，是回路：每次开口都要走一遍从 s(A) 到 A、再回到 s(A) 的路程，去要一个落定的意义，回来落定，然后再次开口、再绕一圈。图上位置：这条回路在第一张图（Graphe 1，法文版 p.805）就画下了，拉康叫它「细胞单元」（cellule élémentaire）——整张欲望图的最小构件。圈的几何学：圈上没有「外面」——你既是从圈里发话的人，又是绕回来收讯息的人，圈上没有一个端点写着你的名字。为什么必须是圆圈而不是直线：所指永远在能指底下滑动（篇 1），意义只在缝合的那一下停住（篇 3）——落定了会再滑开，于是只能一遍遍开口、一遍遍绕圈；屈从不是签一次字就作数，是每句话都在签。"
    },
    {
      "chapter_id": "ch05",
      "mechanism": "需求的环形地狱（infernal circle of demand）：「需求」是历史译名，指的就是「要求」（demande，篇 2、篇 4 讲过的那位）。要求每开口一次就走一遍这个环，而每圈都差一点——因为要求是「对爱的无条件证明」：任何具体的东西（奶、玩具、抱抱、业绩）都只够当一次证明，可「证明」永远不够；具体的东西一出口就落进能指链，成了下一个能指的替身，而能指链永远指向下一环（篇 1 的传送带）——走完一圈的成果不是终点，是下一圈的起点。例子：讨好型人格「再乖一点，他就会满意了」——每走一圈都以为这次到终点了，可是「满意」不在任何一圈上；篇 2 的奶瓶也在这里等着——奶塞过去孩子还闹，他要的是「奶被笑着递过来」，那一个「笑着」就是永远差一点的部分。强调：不是性格缺陷，是结构——只要开口（进入语言）就必然绕圈，圈上没有累积，只有重复；「永远不够」不是贪，是圈的形状。图上位置：s(A)→A→s(A) 这个环本身。"
    },
    {
      "chapter_id": "ch05",
      "mechanism": "Che vuoi?：大他者不回答，反抛问题——你不仅拿不到东西，连「你究竟想要什么」都要被反问。拉康引卡佐特（Cazotte）《痴情魔鬼》（Le Diable amoureux, 1772）：主人公在那不勒斯洞穴里召唤出魔鬼，本要质询这位「他者」，魔鬼的回答却是一声咆哮般的反问：Che vuoi?（意大利语，字面意思正是「你想要什么？」）；拉康说这声咆哮代表超我（surmoi / super-ego——头顶发布「应该」的那个声音位置）的显现——这个注记出自 Seminar VI 首讲（1958-11-12），不在《Écrits》正文里。机制：主体从大他者处以反转形式接收自己的讯息（Seminar VI 次讲 1958-11-19，评述界反复引用）——「你想要什么」不是它的回答，是你自己的问题绕了一圈、换了个方向落回你嘴边；「它想要什么」回来时变成了「你想要什么」，两个问题在圈上互为镜像。图上位置：拉康把这个反问画成一个问号，直接插在大他者 A 的圆圈上（Graphe 3，法文版 p.815 加上的）。例子：问领导「您到底想要什么？」——他让你猜，「再想想」「你觉得呢」，每一条暗示都触发新一轮猜测，越猜越虚；但这不是领导刁难——大他者本来就不是藏着答案的人，它是一个位置，问题必然反抛：没有答案可拿，只能拿回问题。"
    },
    {
      "chapter_id": "ch05",
      "mechanism": "大他者的欲望：de 的双关——「人的欲望是他者的欲望」（le désir de l'homme est le désir de l'Autre，《Écrits》pp.814-815）。法语 de：可读主格（大他者的欲望，它自己有的欲望），也可读宾格（朝向大他者的欲望，想从它那里得到什么）——两读都成立、都活跃，对应两种体验（顺着它的坐标系去要 / 一头雾水「它想要我什么」），是同一枚硬币的两面；拉康紧接着说明这里的 de 给出的是「主观的」规定（subjective determination）——主格读法是根：欲望首先是大他者名下的东西，宾格读法（朝向它的欲望）从它派生。纠正最常见的浅读：这不是「别人晒什么你也想要什么」的模仿论——大他者是结构性位置，不是某个具体的人，更不是社会排行榜；「我想要 X」里，X 这个词、它值不值得要、要到了算不算数，全写在大他者的坐标系里。这也解释了环形地狱为什么转不停：圈里转的根本不是「我要某物」，而是「大他者想要我什么」这个没有答案的问题；欲望被这个坐标系牵引着，顺着能指链换喻式地滑（篇 4 那句「欲望是换喻」现在有了新分量）——每个具体目标都只是圈上的一站。例子：发朋友圈——发之前反复措辞的那几分钟，斟酌的对象不是某个具体读者，而是「他者怎么看我」这个坐标系本身；连「分组可见」都是这个坐标系的产物：你筛的不是人，是让哪个方向的裁判看见你。图上位置：大他者 A 及其欲望——环的燃料端。"
    }
  ],
  "key_mechanisms": [
    "屈从圆圈 s(A)→A→s(A) ＝ Graphe 1 的细胞单元（cellule élémentaire，法文版 p.805）：褚译原文「主体对能指的屈从产生在从 s(A) 到 A 随后又从 A 回到 s(A) 的路程中的。这个屈从是一个圆圈。」——屈从不是一次性臣服，是每次开口都走一遍的回路；圈上没有「外面」，圈上没有一个端点写着你的名字",
    "需求的环形地狱：要求是「对爱的无条件证明」——任何具体的东西只够当一次证明，证明永远不够；具体的东西一出口就落进能指链成为下一能指的替身，走完一圈的成果是下一圈的起点；「永远不够」是圈的形状不是性格缺陷；讨好型人格「再乖一点」+ 篇 2 奶瓶那个「笑着」是永远差一点的部分",
    "Che vuoi?：大他者不回答，反抛问题——卡佐特《痴情魔鬼》（1772）那不勒斯洞穴场景，咆哮代表超我显现（注记出自 Seminar VI 首讲 1958-11-12，不在《Écrits》正文）；机制是「主体从大他者处以反转形式接收自己的讯息」（Seminar VI 次讲 1958-11-19），「它想要什么」与「你想要什么」在圈上互为镜像；问号直接插在大他者 A 的圆圈上（Graphe 3，法文版 p.815）",
    "「人的欲望是他者的欲望」（le désir de l'homme est le désir de l'Autre，《Écrits》pp.814-815）：de 的主格/宾格双关都成立，但「主观的」规定（subjective determination）——主格是根，宾格派生；不是模仿论——大他者是结构性位置不是具体的人/排行榜；「我想要 X」的 X、值不值得要、要到了算不算数，全写在大他者的坐标系里",
    "回扣链收束：所指滑动（篇 1）→缝合点 s(A) 句号位（篇 3）→要求与奶瓶（篇 2）→「欲望是换喻」（篇 4）——圈里转的是「大他者想要我什么」这个没有答案的问题，欲望被坐标系牵引着换喻式地滑；钩子：没有人能撑住这个圈，图右侧有一条画着「完整的脸」的路来盖缝（预告 ep06 镜像路）"
  ],
  "voices_refs": [
    "voice-016",
    "voice-004"
  ],
  "narrative_anchors": [
    {
      "chapter_id": "ch05",
      "section": "屈从是一个圆圈：路二的后半截单独成环"
    },
    {
      "chapter_id": "ch05",
      "section": "需求的环形地狱：每圈都差一点"
    },
    {
      "chapter_id": "ch05",
      "section": "Che vuoi?：大他者不回答，反抛问题"
    },
    {
      "chapter_id": "ch05",
      "section": "大他者的欲望：de 的双关"
    },
    {
      "chapter_id": "ch05",
      "section": "小结"
    }
  ]
}
