{
  "episode_id": "ep04",
  "slug": "ep04-path-subject-vector",
  "topic": "欲望怎么走：那条穿过能指链两次的马蹄形矢线 ΔS——欲望不活在词里；需要穿过能指的隘口被划成 $，欲望（d）住在需要与要求撕开的缝里（换喻，永远差一点），经幻象 $◇a 获得回应",
  "cross_chapter_threads": [
    {
      "chapter_id": "向量 ΔS 与双重交叉",
      "mechanism": "机制/概念：马蹄形矢线 ΔS——从左上角 △ 出发，向下穿过能指链一次（① 与代码相遇的点），折上大他者 A（能指的宝库、整个象征秩序，不是具体的人），再从 A 落回链尾（② 讯息产生之点，即上篇的缝合点 s(A)）——穿过链正好两次，即「双重交叉」。图上位置：矢线在链上方拱起一道弧，两次落点都在链上；意义顺着链走（S→S′），欲望「逆向」从链的外面来。核心机制：「逮住的鱼儿」——把能指链想成一条河，词像水一样流，鱼（欲望）不活在河水里：一句「我爱你」里没有爱，只有三个字的位置关系；欲望在矢线上才现形，读任何一句话都得追问谁在说、站在什么位置说（同一句台词，被告说出与法官说出，欲望完全不同——词是一样的，变的是矢线）。原文依据：褚译 Graphe 1 评注段「意义连环是被看作由向量 S·S' 所承载……在这个逆向上产生了与向量 ΔS 的双重交叉。只有在这后一个向量上我们看到了逮住的鱼儿」（《论主体的倾覆和在弗洛伊德无意识中的欲望的辩证法》）；两处交叉的名字（代码点/讯息点）出自研讨班第六期首讲（1958-11-12）。"
    },
    {
      "chapter_id": "△ → $：穿过能指的隘口",
      "mechanism": "机制/概念：△ 是拉康给「还没被语言碰到的人」画的记号——前语言的、沉默的需要主体（besoin，纯粹需要）；注意这是事后倒推的神话性起点，不是人类学考古。图上位置：矢线起点（左上角）；从 △ 到 $ 中间只有一件事——穿过能指的隘口（defile，两山之间只容一人通过的窄道，研讨班第六期首讲画图时说孩子很早就得学会低头穿过）。核心机制：需要不能原样通过，必须变形、被组织进能指；穿过之前需要是纯粹的，穿过之后主体被划上一杠成了 $（划杠主体）。推论：任何一句话都会背叛你——你想「表达自我」，出口的却是语言表达它自己，「你」只能按语言允许的方式出现，永远说不出「完整的我」。例子：婴儿的哭声落到大他者那里，立刻被当作能指来听、立刻有了意义——你永远找不到一个「纯粹需要」的现场，找到的全是已经穿过隘口的版本。"
    },
    {
      "chapter_id": "需要 → 要求 → 欲望：d 住在撕开的缝里",
      "mechanism": "机制/概念：矢线上依次站着 D（要求 demande，用语言向大他者索要东西的动作）与 d（欲望 désir）——需要是沉默的（△ 层面），一开口需要就被翻译成要求（对爱的无条件要求：奶瓶塞过去孩子还闹，他要的是「奶被笑着递过来」）；要求里永远多出来的那一截，就是欲望。图上位置：d 不在链上、不在 D 上，而在 D 与 △ 之间那道缝里——「撕开」：要求像一块布盖在需要上，永远盖不严，边缘露着缝。原文依据（逐字保留）：法文版《Écrits》p.814「欲望在要求从需要撕裂开的边缘涌现（Le désir s'ébauche dans la marge où la demande se déchire du besoin）」，紧接那句更悖谬：「正因欲望被言说，它才不可被言说」。机制：欲望是换喻——褚孝泉译「欲望确是个换喻」（《拉康选集》p.608，《无意识中字母的动因》收尾段）：它只住在「下一站」这个位置上，要求的满足恰恰证明它满足的不是欲望；你追一个又一个目标（那双鞋、那台机器、那张票），买到三天后心已经不在了——不是不会珍惜，是「追到」这个动作本身把「那个」推去了下一站。"
    },
    {
      "chapter_id": "欲望经幻象回应：$◇a",
      "mechanism": "机制/概念：客体小 a（objet petit a，拉康坚持不翻译）——欲望的客体成因（object-cause of desire）：不是欲望瞄准的目标，而是启动欲望的东西；象征构成中丧失后复现的不可压抑剩余（先有洞，才有「我曾经失去过它」的故事）；它是箩筐不是东西，箩筐本身是空的（冰墩墩、豪车、漂亮衣服都能占据它）。名字清单：乳房、粪便、目光、嗓音、菲勒斯（phallus，象征能指，不是解剖器官），有的清单加「空无」（厌食症临床例），两说并存——指向同一个结构：与主体分离的部分。图上位置：幻象公式 $◇a——左边是被语言劈开、答不出「你想要什么」的划杠主体 $，右边是空的箩筐 a，中间的 ◇ 读作 poinçon（法语「锥凿」）：把 $ 与 a 焊在一起，又让它们永远对不上——包含与不可能同时成立；幻象不满足欲望，它让欲望不崩溃。机制：幻象三件正事——建构欲望（没有剧本你连「想要」的姿态都摆不出来，欲望不是先在的燃料而是在剧本里被组织起来的）、结构现实（现实按剧本裁剪）、遮蔽裂缝（一次次用「如果……就……」把缝糊上）；分析要做的不是实现欲望，而是「穿越幻象」——走到幻象背面，认出剧本是剧本（系列后面会回来收这笔账）。例子：填空练习「只要我____，我就踏实了」——填的是东西还是位置？大概率是位置，可不断换布景、却动不了剧本。"
    }
  ],
  "key_mechanisms": [
    "马蹄形矢线 ΔS 与双重交叉：① 代码点（与代码相遇）② 讯息点 s(A)（缝合点）——矢线穿过能指链正好两次；「逮住的鱼儿」：欲望不活在词（河水）里，在矢线上现形；「逆向」——欲望从链的外面来",
    "△ → $：穿过能指的隘口（defile）——需要不能原样通过，必须变形、被组织进能指；穿过之前需要是纯粹的，穿过之后主体被划上一杠成了 $；△ 是事后倒推的神话性起点",
    "需要 → 要求 → 欲望：d 住在 D 与 △ 之间撕开的那道缝里（《Écrits》法文版 p.814 逐字；「正因欲望被言说，它才不可被言说」）；「欲望确是个换喻」（褚译《拉康选集》p.608）——要求的满足恰恰证明它满足的不是欲望",
    "客体小 a：欲望的客体成因（object-cause of desire），不是目标而是启动器；箩筐本身是空的；名字清单（乳房/粪便/目光/嗓音/菲勒斯/「空无」）指向同一结构——与主体分离的部分",
    "幻象公式 $◇a：◇ 读作 poinçon（锥凿）——包含与不可能同时成立；幻象三件正事（建构欲望/结构现实/遮蔽裂缝）；分析的目标是「穿越幻象」，不是实现欲望"
  ],
  "voices_refs": [
    "voice-006",
    "voice-005"
  ],
  "narrative_anchors": [
    {
      "chapter_id": "ch04",
      "section": "向量 ΔS 与双重交叉（马蹄形矢线、双重交叉①代码点②s(A)、「逮住的鱼儿」、逆向）"
    },
    {
      "chapter_id": "ch04",
      "section": "△ → $：穿过能指的隘口（神话性起点、defile、需要变形）"
    },
    {
      "chapter_id": "ch04",
      "section": "需要 → 要求 → 欲望：d 住在撕开的缝里（D/d 位置、《Écrits》p.814、欲望是换喻）"
    },
    {
      "chapter_id": "ch04",
      "section": "欲望经幻象回应：$◇a（客体小 a 名字清单、poinçon、幻象三件正事、穿越幻象、填空练习）"
    },
    {
      "chapter_id": "ch04",
      "section": "小结（鱼不在词里在矢线上；钩子：矢线折上大他者被「你想要什么？」挡住——指向 ep05）"
    }
  ]
}
