{
  "episode_id": "ep01",
  "slug": "ep01-concepts-language",
  "topic": "读欲望图的第一块地基：能指在先、所指是效果（S/s 翻转），语言是链（S→S′），无意识像语言一样被结构，隐喻与换喻让意义动起来。",
  "cross_chapter_threads": [
    {
      "chapter_id": "ch01",
      "mechanism": "「能指与所指：同一个词，换语境就变味」——索绪尔把语言符号看成两面一体的硬币（能指 signifiant，声音和字形那半边；所指 signifié，概念那半边），拉康竖写成 S 在上、s 在下、中间一杠，并翻转优先级：能指在先，所指不是给定的，而是能指游戏「产生」出来的效果（1957《无意识中字母的动因》：「所指在能指底下不断滑动 / an incessant sliding of the signified under the signifier」，滑动是常态，不是故障）。图上位置：S/s 这一杠是整张图最底层的原材料——能指链的每个环都是 S，所指 s 只在链底下滑（博文 S1→S2→S3 与 s1-s4 图示）。例子：「你真行」——夸人时与刚干完蠢事后阴阳怪气时，同一能指意义完全相反；词和意义之间没有天然的钉子。出处：博客 01 帖「能指与所指」小节；拉康 1957《无意识中字母的动因》（《Instance of the Letter》）。"
    },
    {
      "chapter_id": "ch01",
      "mechanism": "「语言是链：意义不在词里，在位置关系里」——能指链（chaîne signifiante）是「项链环套项链环」：没有一个环能单独承载意义，每一环都坚持要你往下走；也可想成传送带——每个词靠前后位置产生含义，传送带不停，意义就一直在路上。图上位置：链在图上写作 S→S′，S′ 读作表意（signification），是「意义产生」这个动作本身，不是某个词所指的东西，也不是「从词到物」的直线；这条链是整张图的下层横线，后面每一篇讲的路、圈、叉，都长在这条链上。例子：点菜的「随便」和恋人间的「随便」——同一个能指，位置一变，所指完全不同。出处：博客 01 帖「语言是链」小节；《无意识中字母的动因》项链比喻。"
    },
    {
      "chapter_id": "ch01",
      "mechanism": "「无意识像语言：梦、口误、症状的语法」——无意识像语言一样被结构（l'inconscient est structuré comme un langage）：梦、口误、症状不是藏起来的秘密，而是按替换、拼接、跳转的语法组织起来的；读懂无意识就是读懂这种语法。先拆常见误解：不是「无意识里住着一个小人，用母语对你说话」。弗洛伊德「双重铭刻」（double inscription）：同一个行为同时载着意识与无意识两层意义、互相约束，口误是双重铭刻最日常的现场——「明天我请我妈吃饭」是一次严格按语法完成的替换（「她」的槽位里站进「我妈」，出错在选词这一步）；症状是反复出现的同一种「句子」——固定句式的重复。图上位置：这是整张图的前提——图把「语法」几何化成能指链与矢线（本系列 ep07「无意识像语言的几何化/双重复制」回收）。出处：博客 01 帖「无意识像语言」小节；弗洛伊德凝缩与移置（下一小节接到雅各布森两轴上）。"
    },
    {
      "chapter_id": "ch01",
      "mechanism": "「隐喻与换喻：意义怎么动」——雅各布森 1956 两轴：聚合轴（paradigmatic，选择与替代）与组合轴（syntagmatic，序列与连接）；拉康把弗洛伊德接上去：凝缩→隐喻、移置→换喻（通行对应，别写反）。隐喻发生在垂直的聚合轴上：一锤子换名字，被顶替者沉入杠下，新词穿越杠线进入意义——「一辞代另一辞：这是隐喻的公式」，意义瞬间生成（「他是头狮子」）；换喻发生在水平的组合轴上：像火车沿线走、永不到站，意义「坚持而非固持」（insisting, rather than consisting）（「再刷五分钟」，永远差一站；部分代全体 pars pro toto「白宫宣布」）。《无意识中字母的动因》收尾段两个对子（Fink 英译《Écrits》p.439）：「症状是隐喻」「欲望是换喻」——欲望不是一样东西，而是顺着能指链滑、永远差一站的那个「再往前一点」。图上位置：隐喻/换喻是能指链 S→S′ 上意义「动」的两种方式——垂直替换 vs 水平滑动；「欲望是换喻」把欲望挂在链下（ep04 回收）。出处：博客 01 帖「隐喻与换喻」小节；雅各布森 1956；拉康《无意识中字母的动因》收尾段（Fink 英译《Écrits》p.439）。"
    },
    {
      "chapter_id": "ch01",
      "mechanism": "「收尾：意义滑到哪去」——四块砖回顾：一，能指在先、所指是效果（「你真行」）；二，语言是链、意义在位置关系里（「随便」）；三，无意识像语言（口误）；四，隐喻一锤子换名字、换喻顺着链滑（「他是头狮子」「再刷五分钟」）。钩子问题：既然意义在链上滑，它到底在哪停下？——要回答这个，得先认识链上的两个「人」：说话的那个「我」，和听话的那位「他者」（这两个都不好惹：前者并不像你以为的那样在说话，后者也不像你以为的那样是个人）。图上位置：问题悬在链的终点——意义落定由谁打句号（缝合点 s(A)，ep03 回收）；「我」与「他者」即被划杠的 $ 与能指宝库 A，是 ep02 的地基。出处：博客 01 帖「收尾」小节；下一篇预告 02-concepts-speaking.md。"
    }
  ],
  "key_mechanisms": [
    "S/s 公式翻转：能指在先，所指是能指游戏「产生」出来的效果而非给定——「所指在能指底下不断滑动」是常态不是故障（例子「你真行」，词与意义之间没有天然的钉子）",
    "能指链 S→S′：项链/传送带比喻，意义在位置关系里；S′ 是「意义产生」这个动作本身，不是词到物的直线——这条链是整张图的下层横线（例子「随便」）",
    "无意识像语言（l'inconscient est structuré comme un langage）：梦/口误/症状按替换-拼接-跳转的语法组织，不是「小人说母语」；弗洛伊德双重铭刻；口误是严格按语法完成的替换；症状是固定句式的重复",
    "雅各布森两轴 × 弗洛伊德两机制：凝缩→隐喻（聚合轴，一辞代另一辞、一锤子换名字，意义瞬间生成）；移置→换喻（组合轴，顺链滑走、永不到站）——意义「坚持而非固持」（insisting, rather than consisting）；pars pro toto 部分代全体",
    "《无意识中字母的动因》收尾对子（Fink 英译《Écrits》p.439）：「症状是隐喻」「欲望是换喻」——欲望不是一样东西，而是永远差一站的那个「再往前一点」（ep04 回收）",
    "钩子问题：意义在链上滑，到底在哪停下——下一站认识链上两个「人」：说话的「我」（$）与听话的「他者」（A），埋 ep02/ep03"
  ],
  "voices_refs": [
    "voice-011",
    "voice-013",
    "voice-014"
  ],
  "narrative_anchors": [
    {
      "chapter_id": "ch01",
      "section": "能指与所指：同一个词，换语境就变味"
    },
    {
      "chapter_id": "ch01",
      "section": "语言是链：意义不在词里，在位置关系里"
    },
    {
      "chapter_id": "ch01",
      "section": "无意识像语言：梦、口误、症状的语法"
    },
    {
      "chapter_id": "ch01",
      "section": "隐喻与换喻：意义怎么动"
    },
    {
      "chapter_id": "ch01",
      "section": "收尾：意义滑到哪去"
    }
  ]
}
