{
  "episode_id": "ep03",
  "slug": "ep03-path-signifying-chain",
  "topic": "路径一能指链 S→S′：意义怎么动——S′ 是表意（意义产生的进行时而非成品），所指在能指底下不断滑动，缝合点 s(A) 在句尾、从听者那一侧把意义钉住，所以意义事后才成形（après-coup），句号不是说话的人打的",
  "cross_chapter_threads": [
    {
      "chapter_id": "ch03",
      "mechanism": "向量 S→S′ 传送带：欲望图最底层是唯一一条水平主干线，方向只有一个——从左到右；S′ 读作表意（signification），是「意义产生」这个动作本身，不是「意思」这个成品，更不是所指物——S→S′ 画的不是「从词到物」的直达线，而是「意义正在被产生」这个进行时。记号史：拉康后期（如《研讨班二十》）写作 S1→S2（S1 主人能指、S2 知识），欲望图时代（1960）原文写作 S→S′——两个记号体系说的是同一条链。图上位置：图最底层横线，从 S（链起点）到 S′（右端终点）。原文依据：褚孝泉译「意义连环是被看作由向量 S·S' 所承载」；例子「下雨天留客天留我不留」——同一词串可读成留客也可读成逐客，意义不在任何一个字里，在整条链被怎么处理。"
    },
    {
      "chapter_id": "ch03",
      "mechanism": "意义滑动：所指在能指底下不断滑动（an incessant sliding of the signified under the signifier，拉康 1957《无意识中字母的动因》）——不是「偶尔滑一下」，是「不断滑动」：滑动是常态，不是故障。滑动不是「一词多义」：字典并排义项是语言学家的事后标本照，拉康说的滑动是活的运作——每个字被前文压着、又朝后文探着，所指在双重拉扯下不断换位。例子：同一个「好」字——「好，你去吧」放行、「好啊你」翻旧账、「好的呀」敷衍；能指还是那个能指，底下的所指一直在滑。图上位置：横线（能指链）的下方——所指在链底下跑；「欲望是换喻」（desire is a metonymy，语出《无意识中字母的动因》收尾段）的图纸就铺在这条线上（呼应篇 1 的换喻火车）。"
    },
    {
      "chapter_id": "ch03",
      "mechanism": "缝合点 s(A)：s(A)（signifiant de l'Autre，大他者的能指效果）行话别名缝合点（point de capiton，扣点/纽结点/定位点；褚译本译作「断句」）——把滑动中的意义钉住的那个点；s(A) 不是大他者说出的一句话，而是「意义被定下来」这个动作本身。位置两个细节：缝合点在整条链的末端不在起点；它从横线下方伸上来——钉子是听者那一侧打进来的。例子：一句话发进群里，点赞落下之前意思还能变——被当成玩笑、求救还是告别，取决于收到的人怎么标点；领导说「再考虑一下」，结论没出，这句话就没意义。「你控制不了句号，这本身就是『说话』这件事的结构性事实」。图上位置：链右端终点（s(A)），虚线马蹄穿过横线两次，右端的交点正是 s(A)。"
    },
    {
      "chapter_id": "ch03",
      "mechanism": "事后成形（après-coup）：讯息总是事后才成形（c'est après-coup que le message prend forme，拉康 Seminar VI 首讲 1958-11-12）——après-coup 不是「先定下来再传出去」，而是「后到的点，回过头来把前面的东西定下来」；弗洛伊德的德语词 Nachträglichkeit（事后性）被拉康借法语接进语言，安置在图上的右端交点。褚译《拉康选集》直白译文（出《Écrits》对 Graphe 1 的评注段，法文版 pp.806-807）：「在断句那里意义构成为一个终极产品」——断句落下之前，一串字还不是「一个句子」。après-coup 不是神秘的时间倒流，而是结构事实：链条上每个词的地位，要等终点（或至少一个断点）落下之后才被指派——钉子是从后面打进来的。小结句：意义不是句子说出来的，是句子结束之后才被完成的；滑动是常态，落定是例外，而例外只有一个合法位置——句尾。图上位置：右端交点（缝合点处）。"
    },
    {
      "chapter_id": "ch03",
      "mechanism": "小结三块砖与钩子：一，向量 S→S′ 方向从左到右，S′ 是表意（意义产生的过程本身不是成品）；二，所指在能指底下不断滑动，滑动是常态不是故障；三，缝合点 s(A) 在句尾、从听者那一侧钉，所以意义事后才成形，句号不是说话的人打的。钩子：钉子到底是谁按下去的？——大他者；「主体由代码构成……连他自己发出的讯息，也是从大他者那里接收的」（《Écrits》法文版 pp.806-807）。图上位置：图全局——虚线马蹄从 △（前语言的需要）出发穿过这条链两次，缝合点只是它的一个落点；那条路才是欲望真正的行走路线（下一篇的主角）。"
    }
  ],
  "key_mechanisms": [
    "向量 S→S′：最底层唯一水平主干线，方向只有一个（从左到右）；S′ 读作表意（signification）＝意义产生的进行时，不是「意思」成品、更不是所指物——褚译「意义连环是被看作由向量 S·S' 所承载」；「下雨天留客天留我不留」双读例（意义不在字里，在链被怎么处理）；记号史：后期 S1→S2 与 1960 年原文 S→S′ 是同一链",
    "所指滑动：1957《无意识中字母的动因》「an incessant sliding of the signified under the signifier」——滑动是常态不是故障；与「一词多义」（字典标本照）划清：每个字被前文压着、又朝后文探着；「好，你去吧/好啊你/好的呀」三读例；「欲望是换喻」语出该文收尾段",
    "缝合点 s(A)＝point de capiton（褚译「断句」）：把滑动中的意义钉住的那个点——不是大他者的一句话，是「意义被定下来」这个动作本身；两个位置细节：链末端不在起点、从横线下方伸上来（钉子在听者那一侧）；群里等点赞、领导「再考虑一下」例；「你控制不了句号」是结构性事实",
    "事后成形 après-coup：Seminar VI 首讲（1958-11-12）「讯息总是事后才成形」；Nachträglichkeit 的法语化；「在断句那里意义构成为一个终极产品」（《Écrits》对 Graphe 1 评注段，法文版 pp.806-807）；倒着长是结构事实不是时间倒流；滑动是常态，落定是例外，例外只有句尾一个合法位置",
    "收束钩子：句号不是说话的人打的——钉子的真正主人是大他者（「主体由代码构成……连他自己发出的讯息，也是从大他者那里接收的」，法文版 pp.806-807）；虚线马蹄从 △ 出发穿过链两次，另一条路才是欲望真正的行走路线（预告 ep04）"
  ],
  "voices_refs": [
    "voice-007",
    "voice-008"
  ],
  "narrative_anchors": [
    {
      "chapter_id": "ch03",
      "section": "向量 S→S′：一条从左到右的传送带"
    },
    {
      "chapter_id": "ch03",
      "section": "意义滑动：所指在能指底下跑"
    },
    {
      "chapter_id": "ch03",
      "section": "缝合点 s(A)：句号不是说话的人打的"
    },
    {
      "chapter_id": "ch03",
      "section": "事后成形（après-coup）：意义是倒着长的"
    },
    {
      "chapter_id": "ch03",
      "section": "小结"
    }
  ]
}
