{
  "episode_id": "ep06",
  "slug": "ep06-path-mirror",
  "topic": "路径四镜像路 i(a)→m：镜中那张完整的脸是借来的——i(a) 是他者的形象；矢量 i(a)→m 标明自我是「把形象认成自己」这个误认动作的产物，功能只是补偿；头顶压着自我理想 I(A)，由 trait unaire 的首次认同构成，第一块砖是母亲的表情；这一层叠在图右侧，焦虑时人缩回它的画面里。",
  "cross_chapter_threads": [
    {
      "chapter_id": "ch06",
      "mechanism": "镜像阶段（stade du miroir，博客小节「镜像阶段：那张完整的脸是借来的」）：婴儿在六个月到十八个月之间第一次在镜子里认出自己——身体经验还是破碎的，但对镜中完整身影表现出狂喜，仿佛那才是他；拉康常拿动物实验对照（转述性对照）：黑猩猩认出镜像后兴趣很快耗尽，婴儿却对着镜中影像欢欣雀跃，差别在「认」这个动作——猿只把影像当作「那里的东西」，婴儿把它认作「这里的人」；镜中完整影像就是自我最原初的模型（Urbild，德语「原像」）。图上位置：那个形象是借来的——镜中的脸在镜面那一侧、在光线里、在别人的目光下，是 i(a)（image de l'autre，「像我的人」的形象，不是你本人），位于图式 2 新增的镜像层（图右侧）；镜像经验发生在语言之前，归想象层管。出处：ch06 博客首节；图式 2 见法文版《Écrits》pp.808-809；例子：自拍修图——磨皮、瘦脸然后点头说「这就是我」，你心里那张「我」的自画像从一开始就是借来的素材拼出来的。"
    },
    {
      "chapter_id": "ch06",
      "mechanism": "矢量 i(a)→m（博客小节「矢量 i(a)→m：自我是误认的产物」）：图式 2 新加的正是镜像层——拉康原话（图式 2，法文版《Écrits》pp.808-809）：「这个从镜中形象走向自我构成的想象过程……在我们的图中由矢量 i(a)→m 标明」（Ce procès imaginaire qui de l'image spéculaire va à la constitution du moi… est signifié dans notre graphe par le vecteur i(a) → m）。注意方向：从形象（i(a)）指向自我（m），不是反过来；「想象」（procès imaginaire）在拉康那里不是「虚构」的同义词，而是指图像这个层面本身——管「像」，与管「话」的象征层相对。自我（moi / ego）不是先有的东西，而是这条矢线的产物：「把形象认成自己」这个动作把自我「做」了出来；这个动作是误认（méconnaissance，认错了却不自知）——不是一次性失误，而是每次自我确认都在重复的动作，每次说「我」都再认一次错；自我建立在误认之上，功能只是补偿（把一个其实破碎的、被语言划杠的主体 $，拼成一张连贯的脸）。由此推出拉康对自我心理学的批评：把「健全的自我」当作治疗目标，等于把误认的产物当成了终点；例子：朋友圈人设——「我」是一张编辑过的照片，你越经营，越把那张图当成原图。"
    },
    {
      "chapter_id": "ch06",
      "mechanism": "自我理想 I(A)（博客小节「自我理想 I(A)：镜子不管『应当成为什么』」）：镜子只管「我看起来像什么」，回答不了「我应当成为什么」——后一个问题归大他者的目光管，所以图式 2 在镜像层头顶压上 I(A)：自我理想（idéal du moi / ego-ideal，站在大他者立场看、应当成为的、值得被爱的样子）。第一块砖靠首次认同——拉康称之为「构成自我理想的首次认同」（据 Kozicki 引《Écrits》p.808）：不必学走大他者的全部，只需取一个印痕 trait unaire（法语，一划/单一特征：从另一个人身上取下的一个标记）——妈妈的一个口音、爸爸的一个手势、一个名字，这一划就够了。Fink 的临床细节（转引自 terada.ca 讲义 pp.108、116–17）：孩子照完镜子，回头看向母亲——母亲的表情，就是第一个 I(A)；Fink 的概括：主体学会如大他者看自己那样看自己，认同那些使自己在大他者眼中可爱、可接受的性状，内化「要在大他者眼中成为理想所必须成为的样子」。例子：偶像——从偶像身上取下一个特质（自律、洒脱、敢说话）钉在自己身上当尺子；追星追到最后，追的是一个 trait unaire；考试的标准、面试的画像、爸爸眼里「好儿子」的样子——「合格」的尺子从来不在你手里。"
    },
    {
      "chapter_id": "ch06",
      "mechanism": "镜像层的图上位置与回投线（博客小节「镜像层在图上：右侧的一小块」）：镜像层叠在图的右侧、讯息点 s(A) 的上方一带，m 与 i(a) 面对面站着，头顶压着 I(A)；不是随便挑的位置——讯息点是「意义落定」的地方，而自我也要靠大他者的标点才落定，所以它紧挨着那条回路。图式 2 还画了一条回投线（rétroversion，回投）：意义在 s(A) 落定之后，从讯息端绕回镜像层，把「我是谁」事后重画一遍——你的自我形象永远晚于事件，先被定义，再回头认领。这回答了上一篇（ep05）的悬念：人在圆圈里撑不住，就躲进这张脸——镜像路是屈从圆圈的心理缓冲垫。"
    },
    {
      "chapter_id": "ch06",
      "mechanism": "镜像层的防御功能（博客小节「镜像层在图上：右侧的一小块」后半）：评注者指出，焦虑信号触发时，主体用其自我进行防御——被吓到的时候缩回「我是完整的人」的画面（「至少我是个好人」）；面试前一遍遍默念「我挺优秀的」，也是同一个动作；自我是一张盖缝的图，缝（$ 的分裂）盖不住，但每次惊慌，人还是会先抓这张图。出处：ch06 博客第四节（评注者指认，博客未给出具体评注者名）。"
    },
    {
      "chapter_id": "ch06",
      "mechanism": "小结与防混记（博客小节「小结」）：镜像路四步——一，镜像阶段里那张完整的脸是借来的，i(a)，他者的形象；二，图式 2 用矢量 i(a)→m 标明：自我是被「把形象认成自己」这个动作做出来的，建立在误认（méconnaissance）之上，功能只是补偿；三，镜子不管「应当成为什么」——I(A)（自我理想）由 trait unaire（一划）的首次认同构成，第一块砖就是母亲的表情；四，这一层叠在图右侧，焦虑时我们缩回它的画面里。防混记：i(a) 是「我的形象」，不是客体小 a（篇 4 的欲望成因）——一个在镜像层，一个在幻象区。钩子：五条路走了四条，图右侧已经封顶；镜像路管「我看起来像什么」，但图最顶上还压着一条路，管的不是像不像，是「够了还想再要」——享乐（下一站 ep07 爬最顶层）。"
    }
  ],
  "key_mechanisms": [
    "镜像阶段与 i(a)：6-18 个月婴儿认镜中完整身影为「我」（Urbild），但那张脸是借来的——i(a) 是他者的形象（image de l'autre），镜像经验在语言之前、归想象层",
    "矢量 i(a)→m：方向从形象指向自我；自我不是先有的，是「把形象认成自己」这个误认（méconnaissance）动作的产物，每次说「我」都再认一次错；自我建立在误认之上、功能只是补偿（拼一张连贯的脸盖住被划杠的 $）",
    "对自我心理学的批评：把「健全的自我」当治疗目标 = 把误认的产物当终点",
    "I(A) 自我理想：镜子不管「应当成为什么」，那归大他者的目光管；构成靠 trait unaire（一划）的首次认同（据 Kozicki 引《Écrits》p.808），第一块砖是母亲的表情（Fink，经 terada.ca 讲义 pp.108、116–17 转引）",
    "层次区分与彩蛋：镜像认同的产物是理想自我（ideal ego，想象层，镜子里）；I(A) 认大他者的能指（象征层，镜子后面）；Eidelsztein：I(A) 的 I 可读作罗马数字「一」——大他者的「一」，第一能指专门代表你（「没有能指停止为另一个能指代表主体」）",
    "图上位置与防御：镜像层在右侧 s(A) 上方、回投线（rétroversion）事后重画「我是谁」；焦虑时主体缩回「我是完整的人」的画面——自我是一张盖缝的图；防混：i(a) 是「我的形象」，不是客体小 a（幻象区）"
  ],
  "voices_refs": [
    "voice-001"
  ],
  "narrative_anchors": [
    {
      "chapter_id": "ch06",
      "section": "镜像阶段：那张完整的脸是借来的"
    },
    {
      "chapter_id": "ch06",
      "section": "矢量 i(a)→m：自我是误认的产物"
    },
    {
      "chapter_id": "ch06",
      "section": "自我理想 I(A)：镜子不管「应当成为什么」"
    },
    {
      "chapter_id": "ch06",
      "section": "镜像层在图上：右侧的一小块"
    },
    {
      "chapter_id": "ch06",
      "section": "小结"
    }
  ]
}
